{
  "adapters": [
    "vadp_a7ec967536b18dfef10b7784b650c7166010894855148ca2e7d102b7169ed2bc",
    "vadp_c1afea3394413f9cedfc0cae18401564db3118e71f7eea0f02dd3e09158a71af",
    "vadp_82c62045152ccf30cfd042d30d875aed4157dd9570789bf0c000c610381f2d7b"
  ],
  "cells": {
    "heat_alpha_01": "vcell_1f3aa8a457cef2d980bdc010aa0ea557ef4aeca4ad1447cbac0c2b760ec0dbcf",
    "heat_alpha_02": "vcell_45a27a543b9b5d19d05923195efa65facdf21516caa40ed963096f4b9228f8fb",
    "heat_alpha_03": "vcell_94b30e20db5e5889362904c2e66976eeecfffac34fd205ed55d6d4bf1cfbfd87",
    "heat_coverage": "vcell_f11fcbbd33f0b5f91298a6b39f693c79b740b2f450d76df0a831ea3c2942a5de",
    "sidon_source": "vcell_3d576eb6a19b72af81730636c8b35067016635b665fc3716b120348a3456db7c",
    "sidon_translated": "vcell_bc06d6d70f6caa3bfd51be3e39e24ef5014da0f965acca48dddd59a75e585a0d"
  },
  "certified_transfer": {
    "assumptions": [
      "translation-is-componentwise-in-Z"
    ],
    "certificate": {
      "map": "componentwise_translation",
      "offset": [
        10
      ],
      "passed": true,
      "source_detail": "6 pair sums distinct",
      "target_detail": "6 pair sums distinct",
      "translated_points": [
        [
          10
        ],
        [
          11
        ],
        [
          14
        ]
      ],
      "verifier_preserving": true
    },
    "lane": "certified",
    "lost_coordinates": [],
    "packet_id": "vtx_b7a6ad16734b2357c9ea9aaf659c945634900e19757032986e9f46ae576aa750",
    "packet_type": "transfer",
    "preserved_coordinates": [
      "exact_verification"
    ],
    "required_target_receipts": [],
    "schema_version": "vela.constellate.frontier-fabric.v2",
    "signature": {
      "algorithm": "ed25519",
      "value": "mhDwYpmKfKa6Ai+BWi249apyi3s2sk9F7sTBhIkuKZli9LjcjfUQF8HZH3ieKdvzXwO5JGZNbIttcLZSzqO4AQ=="
    },
    "signer_actor": "verifier:translation",
    "signer_kind": "verifier",
    "signer_public_key": "SCM0HHTVW4gr1FRQHzqXSq4frJVaak0W0iv5uVJd+N0=",
    "source_cells": [
      "vcell_3d576eb6a19b72af81730636c8b35067016635b665fc3716b120348a3456db7c"
    ],
    "source_contexts": [
      {
        "parameter": "source",
        "problem": "sidon_Z"
      }
    ],
    "state_effect": "append_eligible_after_human_acceptance",
    "target_cell": "vcell_bc06d6d70f6caa3bfd51be3e39e24ef5014da0f965acca48dddd59a75e585a0d",
    "target_context": {
      "parameter": "translated",
      "problem": "sidon_Z"
    }
  },
  "challenge": {
    "base_observation_id": "vop_3df449e3f9a50740533962e1cb346b79cbe001ebc1c8b7c92f559b7722e9b8ce",
    "hits_every_active_environment": true,
    "packet_id": "vch_58b1b416d49695778627382e9d49f4d37f1274cddbc7415b4429058906b1948f",
    "packet_type": "challenge",
    "proposed_disabled_atoms": [
      "target-receipt:vtrc_e7c1b4bfc3209a918fce7a2be44c949814c48a754bce14a3ca9e6ca16e78f57a"
    ],
    "schema_version": "vela.constellate.frontier-fabric.v2",
    "signature": {
      "algorithm": "ed25519",
      "value": "jV8xP3aigde9wMAnHMsc1q4urzqFEjxyShU4XNhu1RkiKkTNIGGKq+k6OlKyN059XpylyhzC/CREyObNHFX4AA=="
    },
    "signer_actor": "human:challenger",
    "signer_kind": "human",
    "signer_public_key": "idxn+h4PdtEqw55dvyqO2e1/jj7htEtUEFTkXN7bDzc=",
    "state_effect": "none_until_view_decision",
    "target_cell_id": "vcell_45a27a543b9b5d19d05923195efa65facdf21516caa40ed963096f4b9228f8fb"
  },
  "frontier_after": {
    "disabled_atoms": [],
    "discharged_obligations": [
      "vobl_ef92d174c81732f3064c9d269f534407a690b75cf603d67d7cd82bf14f9fb760"
    ],
    "frontier_map_root": "vfm_6e326ad7858b2d01aa98d28a539afe353fc70cd53906d7a47d2d93707c26575d",
    "latent_obligations": [],
    "obligations": [
      {
        "adapter_id": "vadp_c1afea3394413f9cedfc0cae18401564db3118e71f7eea0f02dd3e09158a71af",
        "context": {
          "equations": "heat-1d",
          "initial_conditions": "sin(pi*x)",
          "mesh": "analytic-fixture",
          "parameters": {
            "alpha": "0.2"
          },
          "solver": "reference",
          "tolerance": "1e-9"
        },
        "dependencies": [
          "vcell_45a27a543b9b5d19d05923195efa65facdf21516caa40ed963096f4b9228f8fb"
        ],
        "discharge_evaluator_id": "vela.support-exists.v1",
        "generator_id": "parameter-coverage-alpha-03",
        "kind": "uncovered_parameter_regime",
        "obligation_id": "vobl_22d26543ffaae9620593f20a290b8925cbd2bd1c1ae6d8b9a4b705e635b14e84",
        "rationale": "the successor regime becomes actionable after alpha=0.2 is replay-confirmed",
        "status": "open",
        "target_cell": "vcell_94b30e20db5e5889362904c2e66976eeecfffac34fd205ed55d6d4bf1cfbfd87",
        "verifier_profile_id": "semantic-replay"
      },
      {
        "adapter_id": "vadp_c1afea3394413f9cedfc0cae18401564db3118e71f7eea0f02dd3e09158a71af",
        "context": {
          "equations": "heat-1d",
          "initial_conditions": "sin(pi*x)",
          "mesh": "analytic-fixture",
          "parameters": {
            "alpha": "0.2"
          },
          "solver": "reference",
          "tolerance": "1e-9"
        },
        "dependencies": [],
        "discharge_evaluator_id": "vela.support-exists.v1",
        "generator_id": "parameter-coverage-alpha-02",
        "kind": "uncovered_parameter_regime",
        "obligation_id": "vobl_ef92d174c81732f3064c9d269f534407a690b75cf603d67d7cd82bf14f9fb760",
        "rationale": "the next actionable parameter regime lacks a replay-confirmed solution route",
        "status": "discharged",
        "target_cell": "vcell_45a27a543b9b5d19d05923195efa65facdf21516caa40ed963096f4b9228f8fb",
        "verifier_profile_id": "semantic-replay"
      }
    ],
    "open_obligations": [
      "vobl_22d26543ffaae9620593f20a290b8925cbd2bd1c1ae6d8b9a4b705e635b14e84"
    ],
    "presentation_root": "vpr_b4ed968f10a1d68f528b62018643d45d1a7bb4a59da5005cf4c10aa3f7c68a2b"
  },
  "frontier_before": {
    "disabled_atoms": [],
    "discharged_obligations": [],
    "frontier_map_root": "vfm_f54225e4c5906cb9425b9ac23254e457c298f08e85f510c14fb8d3ce60fdb2be",
    "latent_obligations": [
      "vobl_22d26543ffaae9620593f20a290b8925cbd2bd1c1ae6d8b9a4b705e635b14e84"
    ],
    "obligations": [
      {
        "adapter_id": "vadp_c1afea3394413f9cedfc0cae18401564db3118e71f7eea0f02dd3e09158a71af",
        "context": {
          "equations": "heat-1d",
          "initial_conditions": "sin(pi*x)",
          "mesh": "analytic-fixture",
          "parameters": {
            "alpha": "0.2"
          },
          "solver": "reference",
          "tolerance": "1e-9"
        },
        "dependencies": [
          "vcell_45a27a543b9b5d19d05923195efa65facdf21516caa40ed963096f4b9228f8fb"
        ],
        "discharge_evaluator_id": "vela.support-exists.v1",
        "generator_id": "parameter-coverage-alpha-03",
        "kind": "uncovered_parameter_regime",
        "obligation_id": "vobl_22d26543ffaae9620593f20a290b8925cbd2bd1c1ae6d8b9a4b705e635b14e84",
        "rationale": "the successor regime becomes actionable after alpha=0.2 is replay-confirmed",
        "status": "latent",
        "target_cell": "vcell_94b30e20db5e5889362904c2e66976eeecfffac34fd205ed55d6d4bf1cfbfd87",
        "verifier_profile_id": "semantic-replay"
      },
      {
        "adapter_id": "vadp_c1afea3394413f9cedfc0cae18401564db3118e71f7eea0f02dd3e09158a71af",
        "context": {
          "equations": "heat-1d",
          "initial_conditions": "sin(pi*x)",
          "mesh": "analytic-fixture",
          "parameters": {
            "alpha": "0.2"
          },
          "solver": "reference",
          "tolerance": "1e-9"
        },
        "dependencies": [],
        "discharge_evaluator_id": "vela.support-exists.v1",
        "generator_id": "parameter-coverage-alpha-02",
        "kind": "uncovered_parameter_regime",
        "obligation_id": "vobl_ef92d174c81732f3064c9d269f534407a690b75cf603d67d7cd82bf14f9fb760",
        "rationale": "the next actionable parameter regime lacks a replay-confirmed solution route",
        "status": "open",
        "target_cell": "vcell_45a27a543b9b5d19d05923195efa65facdf21516caa40ed963096f4b9228f8fb",
        "verifier_profile_id": "semantic-replay"
      }
    ],
    "open_obligations": [
      "vobl_ef92d174c81732f3064c9d269f534407a690b75cf603d67d7cd82bf14f9fb760"
    ],
    "presentation_root": "vpr_fece5638e091537770974ed368dc0df5ecc234fb597be94d893e3699d4fc56a2"
  },
  "frontier_repaired": {
    "disabled_atoms": [
      "target-receipt:vtrc_e7c1b4bfc3209a918fce7a2be44c949814c48a754bce14a3ca9e6ca16e78f57a"
    ],
    "discharged_obligations": [
      "vobl_ef92d174c81732f3064c9d269f534407a690b75cf603d67d7cd82bf14f9fb760"
    ],
    "frontier_map_root": "vfm_45adc51d34676ff050792c8fb74ef0cadf18e76d37dcf367c1b848e83f9b8184",
    "latent_obligations": [],
    "obligations": [
      {
        "adapter_id": "vadp_c1afea3394413f9cedfc0cae18401564db3118e71f7eea0f02dd3e09158a71af",
        "context": {
          "equations": "heat-1d",
          "initial_conditions": "sin(pi*x)",
          "mesh": "analytic-fixture",
          "parameters": {
            "alpha": "0.2"
          },
          "solver": "reference",
          "tolerance": "1e-9"
        },
        "dependencies": [
          "vcell_45a27a543b9b5d19d05923195efa65facdf21516caa40ed963096f4b9228f8fb"
        ],
        "discharge_evaluator_id": "vela.support-exists.v1",
        "generator_id": "parameter-coverage-alpha-03",
        "kind": "uncovered_parameter_regime",
        "obligation_id": "vobl_22d26543ffaae9620593f20a290b8925cbd2bd1c1ae6d8b9a4b705e635b14e84",
        "rationale": "the successor regime becomes actionable after alpha=0.2 is replay-confirmed",
        "status": "open",
        "target_cell": "vcell_94b30e20db5e5889362904c2e66976eeecfffac34fd205ed55d6d4bf1cfbfd87",
        "verifier_profile_id": "semantic-replay"
      },
      {
        "adapter_id": "vadp_c1afea3394413f9cedfc0cae18401564db3118e71f7eea0f02dd3e09158a71af",